category_external,severity,application,signature_name,signature_id
vulnerability,critical,HTTP,Microsoft Internet Explorer Memory Corruption Vulnerability,56579
vulnerability,critical,HTTP,Microsoft Internet Explorer Memory Corruption Vulnerability,56580
vulnerability,critical,HTTP,Microsoft Internet Explorer Use-After-Free Vulnerability,56581
vulnerability,critical,HTTP,Mozilla Firefox WebIDL Implementation Privilege Escalation Vulnerability,56582
vulnerability,high,HTTP,Advantech WebAccess SCADA webeye ActiveX ip_addr Parameter Buffer Overflow Vulnerability,56584
vulnerability,critical,HTTP,Microsoft Internet Explorer Memory Corruption Vulnerability,56593
vulnerability,high,HTTP,Microsoft Office Bad Index Remote Code Execution Vulnerability,56603
vulnerability,high,HTTP,Squid Proxy Digest Authentication Denial-of-Service Vulnerability,56617
vulnerability,critical,HTTP,SaltStack Salt SQL Injection Vulnerability,56666
vulnerability,high,HTTP,D-Link Routers Remote Command Execution Vulnerability,56669
vulnerability,critical,HTTP,WhatsApp Remote Code Execution Vulnerability,56670
vulnerability,high,HTTP,Advantech WebAccess SCADA Bwgetval Arbitrary File Deletion Vulnerability,56671
vulnerability,critical,HTTP,Cisco Smart Switch Remote Code Execution Vulnerability,56672
vulnerability,high,HTTP,phpIPAM SQL Injection Vulnerability,56675
vulnerability,medium,HTTP,Eclipse Mosquitto MQTT SUBSCRIBE Topic Stack Overflow Vulnerability,56676
vulnerability,high,HTTP,NPMJS Gitlabhook Remote Command Injection Vulnerability,56679
vulnerability,high,HTTP,File Sharing Wizard Buffer Overflow Vulnerability,56680
vulnerability,critical,HTTP,Apache Karaf XML External Entity Injection Vulnerability,56687
vulnerability,high,HTTP,Cisco RV110W OS Remote Command Injection Vulnerability,56690
vulnerability,critical,HTTP,Eaton Intelligent Power Manager File Inclusion Vulnerability,56691
vulnerability,medium,HTTP,Metasploit VxWorks WDB Agent Scanner Detection,56693
vulnerability,critical,HTTP,Sapplica Sentrifugo SQL Injection Vulnerability,56695
vulnerability,high,HTTP,Microsoft Jet Database Engine Remote Code Execution Vulnerability,56697
vulnerability,critical,HTTP,Joomla! Social Factory SQL Injection Vulnerability,56698
vulnerability,critical,HTTP,CWJoomla Multiple Products SQL Injection Vulnerability,56703
vulnerability,critical,HTTP,Compal CH7465LG Improper Input Validation Vulnerability,56704
vulnerability,informational,HTTP,Compal CH7465LG Improper Input Validation Attempt,56705
vulnerability,critical,HTTP,LibreNMS Command Execution Vulnerability,56707
vulnerability,critical,HTTP,Joomla Article Factory Manager SQL Injection Vulnerability,56708
vulnerability,high,HTTP,Harbor Project Privilege Escalation Vulnerability,56709
vulnerability,critical,HTTP,Joomla Jobs Factory SQL Injection Vulnerability,56711
vulnerability,critical,HTTP,Joomla AlphaIndex Dictionaries Component SQL Injection Vulnerability,56715
vulnerability,critical,HTTP,CMS ISWEB 3.5.3 SQL Injection Vulnerability,56716
vulnerability,critical,HTTP,ZLDNN DNNArticle Information Disclosure Vulnerability,56717
vulnerability,high,HTTP,Drupal Avatar Uploader Information Disclosure Vulnerability,56720
vulnerability,critical,HTTP,E-Negosyo System SQL Injection Vulnerability,56721
vulnerability,high,HTTP,Microsoft Jet Database Engine Remote Code Execution Vulnerability,56725
vulnerability,high,HTTP,Adobe Reader Memory Corruption Vulnerability,56726
vulnerability,critical,HTTP,Joomla Swap Factory SQL Injection Vulnerability,56731
vulnerability,high,HTTP,Redis HyperLogLog hllCount Stack Buffer Overflow Vulnerability,56745
vulnerability,critical,HTTP,Cisco IOS XE WebUI Command Injection Vulnerability Vulnerability,56784
vulnerability,critical,HTTP,Socomec DIRIS A-40 Information Disclosure Vulnerability,56803
vulnerability,high,HTTP,HP Intelligent Management Center Code Execution Vulnerability,56804
vulnerability,high,HTTP,Jenkins Script Security Plugin Sandbox Bypass Vulnerability,56805
vulnerability,high,HTTP,Microsoft Jet Database Engine Remote Code Execution Vulnerability,56808
vulnerability,critical,HTTP,vBulletin Remote Code Execution Vulnerability,56809
vulnerability,critical,HTTP,HPE Intelligent Management Center AMF3 Externalizable Deserialization Vulnerability,56813
vulnerability,critical,HTTP,Pulse Secure Platform Stack-Based Buffer Overflow Vulnerability,56816
vulnerability,high,HTTP,Microsoft Windows HTTP2 Data Dribble Denial-of-Service Vulnerability,56817
vulnerability,high,HTTP,Apple Safari for Windows and Internet Explorer Combined Code Execution Vulnerability,31606
vulnerability,high,HTTP,FortiOS Cookie Parser Buffer Overflow Vulnerability,38767
vulnerability,low,HTTP,Suspicious HTTP Evasion Found,39868
vulnerability,critical,HTTP,Oracle WebLogic Server Java Deserialization Vulnerability,40781
vulnerability,critical,HTTP,Oracle WebLogic Server Java Deserialization Vulnerability,40799
vulnerability,critical,HTTP,Microsoft SMB Client Response Parsing Vulnerability,54503
vulnerability,critical,HTTP,Microsoft Internet Explorer Use-After-Free Vulnerability,55807
vulnerability,high,HTTP,Apache Solr Remote Code Execution Vulnerability,56245
vulnerability,critical,HTTP,vBulletin Remote Code Execution Vulnerability,56632
vulnerability,critical,HTTP,Adobe Reader Memory Corruption Vulnerability,33344
vulnerability,high,HTTP,Mozilla Firefox SharedWorker MessagePort Handing Memory Corruption Vulnerability,36856
